{
  "schema_version": "1.1.0",
  "id": "unit.example.replace-me",
  "version": "1.0.0",
  "title": "교체: 재사용 가능한 기술·개념·도구 Unit",
  "summary": "교체: 특정 업무에 종속되지 않는 역량과 적용 범위를 설명합니다.",
  "item_type": "tool",
  "taxonomy": {
    "major_domain": "replace-me",
    "subdomains": [
      "replace-me"
    ]
  },
  "domain_tags": [
    "replace-me"
  ],
  "capabilities": [
    "교체: 이 Unit을 이수하면 독립적으로 수행할 수 있는 일을 씁니다."
  ],
  "learning": {
    "outcomes": [
      {
        "id": "outcome.example.replace-me.explain",
        "statement": "교체: 핵심 개념과 적용 경계를 설명합니다.",
        "target_level": "D0"
      },
      {
        "id": "outcome.example.replace-me.guided",
        "statement": "교체: 제공된 입력과 절차로 결과물을 만듭니다.",
        "target_level": "D1"
      },
      {
        "id": "outcome.example.replace-me.apply",
        "statement": "교체: 새로운 입력에서 독립적으로 구현하고 증거로 검증합니다.",
        "target_level": "D2"
      }
    ],
    "default_target_level": "D2",
    "maximum_scope_level": "D2",
    "estimated_minutes": 120,
    "scope_expansion_policy": "교체: 운영·보안·비용·관측성까지 필요할 때만 D3 범위를 별도 Unit 또는 Set으로 확장합니다."
  },
  "relations": [],
  "resource_refs": [
    {
      "resource": {
        "id": "resource.example.replace-me.guide",
        "version": "1.0.0"
      },
      "role": "core",
      "required": true
    },
    {
      "resource": {
        "id": "resource.example.replace-me.lab",
        "version": "1.0.0"
      },
      "role": "lab",
      "required": true
    }
  ],
  "requirements": {
    "platforms": [
      "replace-me"
    ],
    "network_required": false,
    "accounts": [],
    "secret_names": [],
    "permissions": [],
    "cost": {
      "model": "unknown",
      "basis": "교체: 학습 1회 및 검증 실행 기준"
    },
    "technology_versions": [
      {
        "name": "교체: 기술 또는 SaaS 이름",
        "constraint": "교체: 공식 문서에서 확인한 버전 또는 확인일"
      }
    ]
  },
  "validation": {
    "completion": "required",
    "checks": [
      {
        "id": "replace-me-independent-assessment",
        "type": "resource",
        "learning_outcome_ids": [
          "outcome.example.replace-me.explain",
          "outcome.example.replace-me.guided",
          "outcome.example.replace-me.apply"
        ],
        "required": true,
        "resource_ref": {
          "id": "resource.example.replace-me.lab",
          "version": "1.0.0"
        },
        "success_criteria": [
          "교체: 결과물의 입력·처리·출력 계약이 확인됩니다.",
          "교체: 자동검사 또는 명시적 루브릭의 통과 증거가 있습니다.",
          "교체: 새로운 입력에서도 동일 역량을 독립적으로 재현합니다."
        ]
      }
    ]
  },
  "sources": [
    {
      "title": "교체: 공식 문서 또는 1차 출처",
      "publisher": "교체: 발행기관",
      "source_type": "official_docs",
      "url": "https://example.com/replace-me",
      "source_version": "교체: 버전 또는 기준일",
      "checked_at": "2026-07-26"
    }
  ],
  "potential_impact_types": [
    "time",
    "quality",
    "capability_unlock",
    "reuse"
  ],
  "lifecycle": {
    "status": "cataloged",
    "owner": "교체: 유지관리 책임자",
    "last_reviewed_at": "2026-07-26",
    "review_due_at": "2026-10-26",
    "note": "교체: 검증된 범위와 아직 검증하지 않은 범위를 구분합니다."
  }
}
