{
  "schema_version": "1.1.0",
  "id": "unit.ai.system-context-design",
  "version": "1.0.0",
  "title": "시스템 컨텍스트 설계",
  "summary": "시스템 지시, 과업 상태, 검색 근거, 도구 결과와 대화 이력을 신뢰 수준·우선순위·예산에 따라 선택·정렬·격리·압축하는 후보 역량입니다.",
  "item_type": "practice",
  "taxonomy": {
    "major_domain": "ai-systems-agents",
    "subdomains": [
      "context-engineering"
    ]
  },
  "domain_tags": [
    "context",
    "context-budget",
    "instruction-boundary"
  ],
  "capabilities": [
    "새 장문 과제에서 필요한 컨텍스트를 신뢰 수준과 예산에 따라 조립하고 누락·상충·오염·초과 시 안전한 중단 또는 대안을 검증합니다."
  ],
  "learning": {
    "outcomes": [
      {
        "id": "outcome.ai.system-context-design.d0",
        "statement": "시스템 지시, 과업 상태, 검색 근거, 도구 결과와 대화 이력의 역할과 신뢰 경계를 설명합니다.",
        "target_level": "D0"
      },
      {
        "id": "outcome.ai.system-context-design.d2-2",
        "statement": "새 과제의 컨텍스트를 선택·정렬·격리·압축하고 위치·누락·오염·예산 초과 시험을 통과시킵니다.",
        "target_level": "D2"
      }
    ],
    "default_target_level": "D2",
    "maximum_scope_level": "D2",
    "estimated_minutes": 120,
    "scope_expansion_policy": "모델 내부 최적화, 대규모 검색 플랫폼과 영속 메모리 구현은 별도 D3 영역입니다."
  },
  "relations": [
    {
      "type": "recommended_before",
      "target": {
        "id": "unit.ai.llm-application-architecture-contract",
        "version": "1.0.0"
      },
      "note": "컨텍스트는 명시된 모델 호출 경계와 입출력 계약 안에서 조립해야 합니다."
    }
  ],
  "resource_refs": [
    {
      "resource": {
        "id": "resource.ai.system-context-design.reference",
        "version": "1.0.0"
      },
      "role": "reference",
      "required": false
    }
  ],
  "requirements": {
    "platforms": [
      "cross-platform",
      "web-browser"
    ],
    "network_required": true,
    "accounts": [],
    "secret_names": [],
    "permissions": [],
    "cost": {
      "model": "free",
      "currency": "KRW",
      "estimated_amount": 0,
      "basis": "공개 Reference 검토 1회"
    },
    "technology_versions": []
  },
  "validation": {
    "completion": "required",
    "checks": [
      {
        "id": "ai-system-context-design-catalog-assessment",
        "type": "manual",
        "learning_outcome_ids": [
          "outcome.ai.system-context-design.d0",
          "outcome.ai.system-context-design.d2-2"
        ],
        "required": true,
        "success_criteria": [
          "상충하는 원천이 있을 때 우선순위와 격리 필요성을 판별합니다.",
          "숨은 fixture manifest의 필수·금지 source ID, 신뢰 등급, 토큰 상한과 기대 중단 상태를 충족하고 선택 로그가 재현 가능합니다."
        ]
      }
    ]
  },
  "sources": [
    {
      "title": "Lost in the Middle: How Language Models Use Long Contexts",
      "publisher": "Transactions of the Association for Computational Linguistics",
      "source_type": "primary_research",
      "url": "https://aclanthology.org/2024.tacl-1.9/",
      "checked_at": "2026-07-28"
    },
    {
      "title": "Effective context engineering for AI agents",
      "publisher": "Anthropic",
      "source_type": "official_source",
      "url": "https://www.anthropic.com/engineering/effective-context-engineering-for-ai-agents",
      "checked_at": "2026-07-28"
    }
  ],
  "potential_impact_types": [
    "quality",
    "cost",
    "time",
    "risk_reduction"
  ],
  "lifecycle": {
    "status": "cataloged",
    "owner": "AX learning workspace",
    "last_reviewed_at": "2026-07-28",
    "review_due_at": "2026-10-28",
    "note": "candidate.ai-systems-agents.system-context-design@1.0.0의 승인 결과를 정규 메타데이터로 등록했습니다. 상세 교재와 학습효과는 아직 검증하지 않았습니다."
  },
  "extensions": {
    "promoted_from": {
      "kind": "capability_candidate",
      "id": "candidate.ai-systems-agents.system-context-design",
      "version": "1.0.0"
    }
  }
}
